, Austria, Belgium, Czechia, Denmark, Estonia, Finland, France, Germany, Greece, Hungary, Iceland, Ireland, Italy, Luxembourg, Moldova, Netherlands, Norway, Poland, Portugal, Romania, Russia Belarus, Slovakia, Slovenia, Spain, Sweden, Switzerland Liechtenstein, Turkey, Ukraine, UK, Åland [6]
Give Way / Yield, IMG, IMG, IMG, IMG, IMG, IMG, IMG, IMG, IMG, IMG, IMG, IMG or IMG, IMG, IMG, IMG, IMG, IMG, IMG, IMG, IMG, IMG, IMG, IMG, IMG, IMG, IMG, IMG, IMG, IMG or IMG (Wales), DEBUTIMAGE
Stop, IMG, IMG, IMG, IMG, IMG, IMG, IMG, IMG, IMG, IMG, IMG, IMG, IMG, IMG, IMG, IMG, IMG, IMG, IMG, IMG, IMG, IMG, IMG, IMG, IMG, IMG, IMG, IMG, IMG, DEBUTIMAGE
Priority road, IMG, IMG, IMG, IMG, IMG, IMG, IMG, IMG, IMG, IMG, IMG, NOT USED, IMG, IMG, IMG, IMG, IMG, IMG, IMG, IMG, IMG, IMG, IMG, IMG, IMG, IMG, IMG, IMG, NOT USED, DEBUTIMAGE
End of priority road, IMG, IMG, IMG, IMG, IMG, IMG, IMG, IMG, IMG, IMG, IMG, NOT USED, IMG, IMG, IMG, IMG, IMG, IMG, IMG, IMG, IMG, IMG, IMG, IMG, IMG, IMG, IMG, IMG, NOT USED, DEBUTIMAGE
Give way to oncoming traffic, IMG, IMG, IMG, IMG, IMG, IMG, IMG, IMG, IMG, IMG, IMG, NOT USED, IMG, IMG, IMG, IMG, IMG, IMG, IMG, IMG, IMG, IMG, IMG, IMG, IMG, IMG, IMG, IMG, IMG IMG, DEBUTIMAGE
Priority over oncoming vehicles, IMG, IMG, IMG, IMG, IMG, IMG, IMG, IMG, IMG, IMG, IMG, NOT USED, IMG, IMG, IMG, IMG, IMG, IMG, IMG, IMG, IMG, IMG, IMG, IMG, IMG, IMG, IMG, IMG, IMG IMG, DEBUTIMAGE
, Austria, Belgium, Czechia, Denmark, Estonia, Finland, France, Germany, Greece, Hungary, Iceland, Ireland, Italy, Luxembourg, Moldova, Netherlands, Norway, Poland, Portugal, Romania, Russia Belarus, Slovakia, Slovenia, Spain, Sweden, Switzerland Liechtenstein, Turkey, Ukraine, UK, Åland
