Format,Compression algorithm,Raster graphics/ Raster graphics,Color depth,Indexed color,Transparency in graphic files,Metadata,Interlace (bitmaps),Multi-page,AnimationAnimation,Layers,Color management,Extend­able,High dynamic range imaging
Adobe Illustrator Artwork,Lossy and lossless,Both," 1, 8, 24, and 32 (possibly with multiple palettes) ",Yes,Yes,Yes,No,Yes,No,Yes,Yes,Unknown,No
BMP file format," None, Run-length encoding, JPEG, and PNG ",Raster," 1, 4, 8, 16, 24, 32, and 64 ",Yes,Yes,No,No,No,No,No,Yes,No,No
Better Portable Graphics," HEVC, Lossy and lossless ",Raster,8 to 14 bits per channel,No,Yes,Yes,No,No,Yes,Unknown,Yes,Unknown,Unknown
CorelDRAW,Lossy and lossless,Both," 1, 8, 24,and 32 (multiple palettes) ",Yes,Yes,Yes,No,Yes,No,Yes,Yes,Unknown,No
Cartesian Perceptual Compression,CPC,Raster,1,No,No,Yes,No,Yes,No,No,No," Yes, via embedded dictionary ",No
Encapsulated PostScript," None, LZW, LZW, LZW, LZW ",Both,Device specific,No,Yes,Yes,N/A,Yes,No,Yes,Yes,Yes,Yes
OpenEXR," None, Run-length encoding, Run-length encoding, Piz, PXR24, and B44, B44A, DWAA, DWAB ",Raster,16–128 (IEEE floating-point standard),No,Yes,Yes,No,Yes,No,Yes,Yes,Yes,Yes
Farbfeld (page does not exist),None,Raster,64 (16-bits-per-channel),No,Yes,No,No,No,No,No,No,No,No
Free Lossless Image Format," Lossless, MANIAC entropy coding ",Raster,1 to 16 bits per channel,Yes,Yes,Yes," Yes, Adam∞ ",No,Yes,No,Yes," Yes, via chunks "," Yes, with suitable ICC profile "
GIF,LZW,Raster,Indexed (1bpc to 8bpc) and grayscale (8bpc),Yes,Yes; 1bpp plane-only mask using color index,Yes,Yes,Yes,Yes,Yes,No,Yes (GIF89a),No
HD Photo / HD Photo,Lossy and lossless bi-orthogonal transform,Raster," 1, 2, 8, 16, 24, 32, 48, 64, and 128 (IEEE floating-point standard) ",No,Yes,Yes,Yes,Yes,No,No,Yes,Yes,Yes
ILBM,Optional Run-length encoding,Raster," 1, 2, 4, 8, 16, 32, 64, 64 Extra Half-Brite, 128, 256 (Extra Half-Brite), 4,096 (Extra Half-Brite pseudo 12-bit), 4,096 pure Extra Half-Brite, 262, 144 (Extra Half-Brite pseudo Extra Half-Brite), and Extra Half-Brite ",Yes,No,Yes,Yes,No," Yes, Palette-shifting ",No,No,Yes,No
IMA,Lossy and lossless original mutiresolution analysis transformation,Raster," 8-bit, 8-bit 8-bit, 8-bit 8-bit ",No,Yes,Yes,No,No,No,No,Yes,Yes,Yes
JPEG," Lossy (and partly lossless), Discrete cosine transform, Discrete cosine transform, and Discrete cosine transform predictive nearest neighbor ",Raster," 8-bit (8-bit), 12-bit, and 8-bit ",No,No,Yes,Yes,No,No,No,Yes,No,No (see unofficial JPEG-HDR)
JPEG 2000,Lossy and lossless (Discrete Wavelet Transform),Raster,8-bit and 8-bit (8-bit) with possibly color up to 8-bit,No,Yes,Yes,Yes,No,No,No,Yes,Unknown,No
Krita,None,Both," Grayscale, Grayscale, Grayscale (8bpc, 16bpc, float16bpc, float32bpc), Grayscale, Grayscale and Grayscale (8bpc, 16bpc, float32bpc) ",No,Yes,Yes,No,Yes,Yes,Yes,Yes,Yes,Yes
ORA,Lossless,Both," 1, 2, 4, 8, 16, 24, 32, 48, and 64 ",Yes,Yes,Yes,Yes,Yes,No,Yes,Yes,Yes,Yes
PAM graphics format,None,Raster,Up to 16,No,Yes,Yes,No,Yes,No,No,No,Yes,No
PCX," None, Run-length encoding ",Raster," 1, 2, 4, 8, 24 and 32 ",Yes,Yes,No,No,Yes,No,No,No,No,No
Progressive Graphics File,Lossy and lossless (Discrete Wavelet Transform),Raster," Grayscale: 1, 8, 16, 31; Grayscale: 12, 16, 24, 32, and 48 ",Yes,Yes,Yes,Yes,No,No,No,No,Unknown,No
PICT," None, Run-length encoding, and QuickTime ",Both," 1, 2, 4, 8, 16, 24, and 32 ",Yes,Yes,Yes,Unknown,No,No,No,Unknown,No?,No
PLD," Optional ZIP, JPEG ",Both," 1, 4, 8, 16, 24, 32, 48, and 64 ",Unknown,Yes,Yes,Unknown,Yes,Yes,Yes,Yes,Yes,Yes
Portable Network Graphics,Lossless and DEFLATE (algorithm),Raster," Binary image (1bpc), Binary image (8bpc), Binary image and Binary image (8bpc, 16bpc) ",Yes," Yes; Indexed color, Indexed color and Indexed color ",Yes," Yes, Adam7 algorithm ",No,No (but see Multiple-image Network Graphics and Multiple-image Network Graphics),No,Yes," Yes, via chunks "," No, see discussion "
Portable pixmap,None,Raster,Up to 16,No,No,Yes,No,Yes,No,No,No,No,No
Adobe Photoshop,None and Run-length encoding,Both," Binary image (1bpc), Binary image, Binary image (8bpc), Binary image, Binary image, Binary image, Binary image and multichannel (8bpc, 16bpc, 32bpc) ",Yes," Yes; Indexed color, Indexed color, Indexed color, Indexed color and Indexed color ",Yes,N/A,No,Yes,Yes,Yes,No?,Yes
Corel Paint Shop Pro,None,Both," 1, 2, 8, 16, 24, 32, and 48 ",Yes,Yes; 8b and 16b per-pixel Alpha channel,Yes,No,Unknown,No,Yes,Unknown,Unknown,No
Scalable Vector Graphics,None and lossless Gzip,Vector[10],RGB (8bpc),No,Yes,Yes,N/A,Yes (1.2 draft)[11],Yes (Synchronized Multimedia Integration Language/Synchronized Multimedia Integration Language),Yes,Yes[12]," Yes, XML based ",N/A
Truevision TGA," None, Run-length encoding, and other ",Raster," 1, 2, 4, 8, 16, 24, and 32 ",Yes,Yes,Yes,No,No,No,No,No,Unknown,No
Tagged Image File Format," None, LZW, LZW, LZW, and other ",Both," 1, 2, 4, 8, 16, 24, and 32 ",Yes (1–8 bit modes),Yes,Yes," Yes, for JPEG compression ",Yes,No,Yes,Yes," Yes, via tags "," Yes, TIFF float "
WebP,Lossy and lossless,Raster," YUV420P (12bpp), YUVA420P (20bpp) and YUV (8bpc) ",No,Yes,Yes,No,Yes,Yes,No,Yes,Yes,No
XAML,None,Vector,32 and 64,No,Yes,Yes,N/A,Yes,Yes,Yes,No,Yes,Yes
XCF (file format)," None and lossless (Gzip, Gzip and Gzip) ",Both," Indexed color (8bpc), Indexed color and Indexed color (8bpc, 16bpc, float16bpc, 32bpc, float32bpc, float64bpc) ",Yes,Yes,Yes,No,No,Yes,Yes,Yes,Yes,Yes
Format,Compression algorithm,Raster graphics/ Raster graphics,Color depth,Indexed color,Transparency in graphic files,Metadata,Interlace (bitmaps),Multi-page,Animation,Layers,Color management,Extend­able,High dynamic range imaging
